id,artist,title,lyrics
386690,Tame Impala,Expectation,"Everything you ever told me could have been a lie
We may never have been in love
Stuck on thinking that there is always something to lose
Or a hit from above
Or a hit from above
I don't need what I'm holding
What I'm holding on to, I wish I knew
But meanwhile...
Fluctuations are aching my soul
Expectation is taking its toll
Expectation is taking its toll
'Cause everything you ever told me could have been a lie
We may never have been in love
And then I will escape
I'll never, ever have to see another disappointed face
No one to please
Every now and then, it feels like
In all of the universe, there is nobody for me
I told myself I wouldn't care, no I wouldn't care
But when she said she'd come 'round
I combed my hair, yes, I checked my hair
You might also like
Oh, and meanwhile, meanwhile, meanwhile...
Fluctuations are aching my soul
Expectation is taking its toll
Fluctuations are aching my soul
Expectation is taking its toll
Fluctuation does make me feel old
Expectation is taking its toll
Fluctuations are aching my soul
Expectation is taking its toll
Fluctuations are aching my soul"
132479,Tame Impala,Be Above It,"I gotta be above it
Gotta be above it
Gotta be above it
Gotta be above it
And I know that I gotta be above it now
And I know that I can't let them bring me down
And I gotta bide my time as a face in the crowd
And I know that I gotta be above it now
And I know that I gotta be above it now
And I gotta bide my time as a face in the crowd
I know that I gotta be above it now
And I can't let them all just bring me down
This time I'm just gonna take it
Or I'm never gonna shake it
I'll just close my eyes and make it so that
All those little things don't affect me, now
Know that I gotta be above it now
And I can't let them all just bring me down
You might also like
This time I'm just gonna take it
Or I'm never gonna shake it
I'll just close my eyes and make it so that
All these little things don't affect me now"
5175460,Tame Impala,Glimmer,"It's like, ""Oh, bass,"" cool
You know how you make the bass better?
Crank the bass up (Yeah)
You know how to make the kick drums better?
Just crank the bass up
And then it's like, ""No, not really""
Might just find it after all
Might just find it after all
Might just find it after all
Might just find it after all
Might just find it after all
Might just find it after all"
251009,Tame Impala,Desire Be Desire Go,"Feel it come
I, I don't know how long it's gonna stay with me
Woah, I'll let desire be, desire go
Oh, dare I face the real world?
Every day, back and forth, what's it for?
What's it for? Back and forth, every day
Every day, back and forth, what's it for?
I don't know, I'll get out
Won't have to check my watch
I, I don't have the verve to belong to this dead side
Woah woah, why I ever tried, I, I don't know
Oh, dare I face the real world?
Every day, back and forth, what's it for?
What's it for? Back and forth, every day
Every day, back and forth, what's it for?
I don't know, I forget
Try to let desire be, desire go
Feel, feel it come, feel it come
I...
You might also like
Feel it come
I, I don't know how long It's gonna stay with me
Woah, I'll let desire be, desire go"
663771,Tame Impala,Lucidity,"I know where you went, but I don't know how you got there
I know where you went, but I don't know how you got there
Silver tongue hill, where you talk up what I'd play down
I would speak up, but I wouldn't know what to say
Oh, to say
Lucidity, come back to me
Put all five senses back to where they're meant to be
Oh, it's hard to tell, breaks down
There is a will, there is a way
Wandering around like spare time never knew it
I might suck, fizzle or I might just float away
(Float away)
And we'll go running off tonight
High above, where we won't even
Need to reach the sky, my love
Oh, there will be a change in the air
Nobody will be anybody else
Lucidity, come back to me
Put all five senses back to where they're meant to be
Oh, where we'll go, tiptoe
Tread boldly right down to the lair"
386718,Tame Impala,"Runway, Houses, City, Clouds","But don't remind me of home
There's everywhere I'd rather go
It's true that some things have to change
Oh no
And don't remind me of home
Or I might notice where I am
It's true that some things
Have to change
I know some things have to change
It's true that some things have to change
I know some things have to change
Oh no
I'm gazing out the window
As I ascend into the sky
But I'm the one who's left behind
I'm the one who's left behind
There is nothing that is safe
I know some things have to change
Oh yeah, I do
Yeah, I do
You might also like
But don't remind me of home
In case it isn't quite the same"
749568,Tame Impala,Sundown Syndrome,"Please don't get answers from eyes
You know that mine can't lie quite as well as yours
Just let the spare moment flow
Rounding steps as I go through the open doors
Please don't deflate from a sigh
I'd hold still every time but I'd start to shake
I wander around for days
Wondering what I'll say when they want the truth
You will never know how hard I try
To keep from waning while waiting at the start
The depth of every touch is real as you need
But words don't do any favours for me
Oh...
You will never know how hard I try
To keep from waning while waiting at the start
The depth of every touch is real as you need
But words don't do any favours for me
You might also like
You will never know how hard I try
To keep from waning while waiting at the start
The depth of every touch is real as you need
But words don't do any favours for me
You will never know how hard I try
To keep from waning while waiting at the start
The depth of every touch is real as you need
But words don't do any favours for me
You will never know how hard I try
To keep from waning while waiting at the start
The depth of every touch is real as you need
But words don't do any favours for me
Oh..."
521387,Tame Impala,Beverly Laurel,"Why do they say that they know what's right for me?
Hey, I know what's right for me
Why do they say that they know what's right for me?
Hey, I know what's right for me
I know what's right
I know what's right
I know what's right for me
I know what's right
I know what's right
I know what's right for me
(For me)
I know what's right for me
I know what's right for me
I know what's right for me
I know what's right for me"
3321422,Tame Impala,Taxi’s Here,"I was trying to resolve in a way
That felt natural
Oh, I was hoping it would come outright
Who was I kidding
Push the button and start counting down
Oh, time is crawling to the moment
Beyond which
I can choose
I can fall
I can lose, control
I concur
With the doubt
But I can’t
Turn back round
And they dread
What’s beyond
But time
Is rolling on
Rolling on
Now let’s do this right
Everybody
(And I’ll be trying)
It wouldn't come out right
You might also like
I can fold
I can lose, control
I can lose, control
I can face, the unknown
Yes, I must
Venture there
If I fail
I don’t care
(Now let’s do this right)
There’s so much
Left unclear
But it’s time
Taxi’s here"
7262964,Tame Impala,No Choice,"It doesn't matter if I want to go somewhere new
At the end of the day, I have no choice
It wouldn't matter that I had to break it with you
Going over and over brings no joy
It doesn't matter if I want to go somewhere new
At the end of the day, I have no choice
And if you're telling me that I've got so much to lose
All the talking about it, it's all noise
Nice and short
There must be something more
Life's a chore
What are wе living for?
Let it out
I can see it now
Tryin' to hold it down
I hear it now
You might also like
All the constants in your futurе bore you
Kinda makes your mind up for you
Knowing just what lies before you
Leaves you no surprise
It doesn't matter if I want to go somewhere new
At the end of the day, I have no choice
It wouldn't matter that I had to break it with you
Going over and over brings no joy
Nice and short
There must be something more
Life's a chore
What are we living for?"
3061313,Tame Impala,Vital Signs,"You're always trying
To hide in the night
And blink at the door
You'd let it go
Though you'll never know
When it all may be gone
We close our heart
We shut down our world
To rumors you know
Tore down the shield
Your future reveals
Where the feel's yet to go
You've gotta open up your mind and feel the love in your life
You've got to open up your heart feel the love in your life
You've gotta open up your mind and feel the love in your life
You've got to open up your heart feel the love in your life
Love in your lifer heart
And feel love in the light
They won't decide
Watch time glassing by
Then float away
You can't get ill
Just typewrite on in
To the rows we could play
Dissatisfied
You always have tried
To divert with goodbyes
Though what you seek
Who knows it could be
Right in front of your eyes
You might also likeYou've gotta open up your mind and feel the love in your life
You've got to open up your heart feel the love in your life
You've gotta open up your mind and feel the love in your life
You've got to open up your heart feel the love in your life
Love in your life
(Repeat to the end)"
226829,Tame Impala,Half Full Glass Of Wine,"Said you wouldn't be home late tonight
I gave up waiting at seventeen past midnight
Now my only company's a half full glass of wine
Leave me no choice but to plot my revenge
Leave me no choice but to plot my revenge
It's been so long
Since I've held your hand
You don't know how hard it can be
Thank God that I've been blessed with a patient mind
Cause' what I want to happen won't happen in a very long time
Now my only company's a half full glass of wine
Leave me no choice but to plot my revenge
Leave me no choice but to plot my revenge
Leave me no choice but to plot my revenge
You might also like
It's been so long
Since I've held your hand
You don't know how hard it can be
You don't know how hard it can be"
7225688,Tame Impala,The Boat I Row,"Many ways to go
It's hard to self-assure
When everyone's a pro
Saying, ""It's so obvious""
But really, they don't know (They don't know)
Just like a monster that is (Man or machine)
Only a shadow (A shadow)
From which I'm already runnin'
Easy, I suppose
And even if it takes
A hundred-thousand goes
The way's in front of me 'cause
That's the one I chose (I chose)
It's always starin' at you (Barely a choice)
That's the boat I row (I row)
And though it seems to be
Endless problems
Relentless
I know I'm oblivious
Bit overzealous
And possibly jealous
I run till I'm breathless
Try to suppress it
I couldn't bear it, so onward, I go
You might also like
Many ways to go
It's hard to self-assure
When everyone's a pro
Saying, ""It's so obvious""
But really, they don't know (They don't know)
Just like the monster that is (Man or machine)
Only a shadow (A shadow)
But you're already runnin'
Endless problems
Relentless
I know I'm oblivious
Bit overzealous
And possibly jealous
I run till I'm breathless
Try to suppress it
I couldn't bear it, so onward, I go"
136125,Tame Impala,Led Zeppelin,"Senses taking over
Thought you set me free
I've tried to get up
But it was pouring down on me
Keeps on burnin' deeper
Desperate for you to be
Seven psychiatrists couldn't drag it out of me
Ooh, this is what I need
Ooh, tell me you're allowed to let it show
Just like it was magic
I was far enough to see
Better than to get just what
A stranger did to me
Is it 'cause I lie?
Is it 'cause I don't?
Well, I just don't know
Keep on asking me
Darling, let me see (keep on asking)
I'd give anything to let it go"
1497345,Tame Impala,I Don’t Really Mind,"Shifting, shifting, shifting aloud
Like it makes so much difference to me
Huffing, puffing, marching around
Like I know how much better it should be
I know it looks like I disagree, nine-tenths of the time
But I don't really mind
But I don't really mind
But I don't really mind
But I don't really mind
Childhood puppy is old and gruff
Your mother wants to give him away
Pillar of strength was lifted off his deathbed
Three weeks ago today
But I don't really mind
But I don't really mind
But I don't really mind
But I don't really mind
But I don't really mind
But I don't really mind
But I don't really mind
But I don't really mind
But I don't really mind
But I don't really mind
But I don't really mind
But I don't really mind..."
136121,Tame Impala,She Just Won’t Believe Me,"But she just won't believe me
She just won't believe me
I'd never be deceiving
But she just won't believe me"
1405046,Tame Impala,The Bold Arrow of Time,"Overhead ether flow moment
Colours run
Time, so
Slow
Slow
I've never seen the arrow of time fly so
Low
And time flows on"
3321421,Tame Impala,Powerlines,14 ContributorsThis song is an instrumental
898162,Tame Impala,Remember Me,"Remember me, I'm the one who had your babies, ahh
Remember me, I'm the one who had your babies, ahh
Remember me, I'm the one who had your babies, ahh
Remember me, I'm the one who had your babies, ahh
Remember me, I'm the one who had your babies, ahh
Remember me, I'm the one who had your babies, ahh
Remember me, I'm the one who had your babies, ahh
Remember me, I'm the one who had your babies, ahh
Remember me, I'm the one who had your babies, ahh
Remember me, I'm the one who had your babies, ahh
Remember me, I'm the one who had your babies, ahh
I'm the one who had your babies, I'm the one who had your babies
I'm the one who had your babies, I'm the one who had your babies
I'm the one who had your babies, I'm the one who had your babies
I'm the one who had your babies, I'm the one who had your babies
I'm the one who had your babies, I'm the one who had your babies
Oh, remember me, I'm the one who had your babies, ahh
Remember me, I'm the one who had your babies, ahh
Remember me, I'm the one who had your babies, ahh
Remember me..."
2181767,Tame Impala,Jeremy’s Storm,14 ContributorsThis song is an instrumental
9160901,Tame Impala,Journey To The Real World,"Somewhere else there is to see
The future is a mystery
I wonder what we'll see
When we get to
The real world
We're going to
The real world
The real world"
1044820,Tame Impala,41 Mosquitoes Flying in Formation,"Lazy bones and no concern
Sees forty one mosquitoes flying in formation
I'm alright, but my pet cockroach died of starvation
Sleep 'till late, I won't mind if we do nothing today
Come and stay, bring your friends
Who needs floor space anyway?
So do you not want me to come over?
So do you not want me to come over?
Not much we know, so off we go
Ahhh-ahhh, ahhh-ahhh, ahhh-ahhh, ahhh-ahhh
Ahhh-ahhh, ahhh-ahhh, ahhh-ahhh, ahhh-ahhh
Ahhh-ahhh, ahhh-ahhh, ahhh-ahhh, ahhh-ahhh
The other side of the land, they like my brain
They don't waste time and they don't wait
And do what they want
As long as I don't have to concentrate
Broken drums, thriving dreams
Not much else between these walls
One more spliff, I am already gone but duty calls
So do you not want me to come over?
So do you not want me to come over?
You might also like
Not much we know, so off we go
Ahhh-ahhh, ahhh-ahhh, ahhh-ahhh, ahhh-ahhh
Ahhh-ahhh, ahhh-ahhh, ahhh-ahhh, ahhh-ahhh"
937386,Tame Impala,Skeleton Tiger,"Now that all these walls are down
Wonder what I'll tell you
You can do what you want as long
As the curtain is high and strong
We should be like this all the time
For the Earth, one day will die
Count the number of things you are
See how long it takes you
You can do what you want as long
As the curtain is high and strong
We should be like this all the time
For the Earth, one day will die, oh!
You can do what you want as long
As the curtain is high and strong
We should be like this all the time
For the Earth, one day will die, oh
Oh"
2329248,Tame Impala,Island Walking,"I could never see your eyes
And I can't see past the lies
Which is why
I still long for us
And in the meantime
Here comes the chorus
I know you like your own kind
And that pulls me out of line
Which is why
I can drop anchor for a long time
When I am drunk
And I feel fine
Yeah, I feel fine"
1169731,Tame Impala,Wander,"Save your fragile mama's heart
And while she will come for you
But I wander
And I wonder just how far will you need to be
For shaking talk so easily
For hours on end, I wander
Still I don't even know her
Feel just like I need to be
Back where I was before
I couldn't go back
But I wander
And I wonder just how far will you need to be
For shaking talk so easily
For hours on end, I wander
Still I don't even know
How it keeps a lid on me
How it keeps a lid on me (How)
How it keeps a lid on me
How it keeps a lid on me (How)
You might also like
And I wonder
Just how far will you need to be
For shaking tough so easily
For hours on end, I wander
(Ooh)
How it keeps a lid on me
How it keeps a lid on me (And I wonder)
How it keeps a lid on me (Just how far will you need to be)
How it keeps a lid on me (For shaking tough so easily)
How it keeps a lid on me (For hours on end I wonder)
How it keeps a lid on me
How it keeps a lid on me
How it keeps a lid on me
Jay: What were you saying?
Kevin: (Laughing) That was like, the worst cymbal ever
Jay: What's up—Well, I don't understand what you're trying to tell me
Kevin: Sounds like... human hair
Jay: (Laughing) You could have waited!
(Jay plays loud drum fill)
Kevin: What, Gumby?
Jay: I said, I'm sick of you taking over
Kevin: Oh, aw
Jay: I want to record the drums on all our albums, alright?
Kevin: (Laughing)
Jay: Modular? Hear that?"
1134621,Tame Impala,Slide Through My Fingers,"When I get up I've dreamt too long
Everything else is half as strong
I could see though, outside my head
They got it right, I got it wrong
I've let too much of it slide through my fingers
Fear that has fouled all the love I could bring her
Shook off her optimistic hand
I am too fixed on what I've planned
Who is the one who can't let go?
I will miss out, hell, don't I know
I've let too much of it slide through my fingers
Fear that has fouled all the love I could bring her
(All the love I could bring her)
I've let too much of it slide through my fingers
Fear that has fouled all the love I could bring her
I've let too much of it slide through my fingers
Fear that has fouled all the songs I could sing her
I've let too much of it slide through my fingers"
8901381,Tame Impala,Wings Of Time,"We are number one
It is clear to us now
All that's said and done
I knew it all along
And the world will find out
But, oh, it takes time to love
Do you see the wings of time?
Do you feel a sense of pride now?
Do you know you'll never fly alone?
We did it right this time
I know I came on strong
I was just excited
You might come along with us
Now we're going home
To the old horizon
To love, live, fall, survive
Do you see the wings of time?
Do you feel a sense of pride now?
Do you know you'll never fly alone?
We did it right this time
We did it right this time
We did it right this time
We did it right this time
You might also like
(We did it right this time
We did it right this time
We did it right…)"
3024909,Tame Impala,When The Feeling’s In The Core,"Send me back, the feeling's reached the core
Ocean waves sound more like whispers from the shore
See my eyes look back again once before
See my eyes look back again once before
There is no
There's nothing that I need to say
See my eyes look back again once before
See my eyes look back again once before
Once before
See my eyes look back again once before
See my eyes look back again once before
See my eyes look back again once before
(Once before)
See my eyes look back again once before
Feeling's in the core
Feeling's in the
Feeling's in the core"
3078485,Tame Impala,Latenight Moonlight,"Thought of something in the moonlight
What do you think it was?
Thought of something in the moonlight
Forgot it by the morning sun
Whispering the sweeter nothings, feel you high above. Now I'm your love
Tell me why you think I love you, and I'll tell you if your right. Told you all my darkest secret, but I think I lied
Whispering the sweeter nothings, feel you high above. Now I'm your love
Will I ever find your love? Tell me before the break of day
I was passing down your fair, latenight moonlight fades away
Latenight moonlight fades away
Latenight moonlight fades away"
3313569,Tame Impala,Confide in Me (triple j Like A Version),"I stand in the distance
I view from afar
Should I offer some assistance?
Should it matter who you are?
We all get hurt by love
And we all have our cross to bear
But in the name of understanding now
Our problems should be shared
Confide in me
Confide in me
I can keep a secret
And throw away the key
But sometimes to release it
Is to set our children free
We all get hurt by love
And we all have our cross to bear
But in the name of understanding now
Our problems should be shared
You might also like
Confide in me
Confide in me
Confide in me
Confide in me
Stick or twist, the choice is yours
Hit or miss, what's mine is yours
Stick or twist, the choice is yours
Hit or miss, what's mine is yours
We all get hurt by love
And we all have our cross to bear
But in the name of understanding now
Our problems should be shared
Confide in me
Confide in me
Confide in me
Confide in me
Confide in me
Confide in me"
2093857,Tame Impala,Canyons Sunrise Reprise,"Please don't get answers from eyes
You know that mine can't lie quite as well as yours
Just let the spare moment flow
Rounding steps as I go through the open doors
Please don't deflate from a sigh
I'd hold still every time but I start to shake
I wander around for days
Wondering what I'll say when they want the truth
You will never know how hard I try
To keep from waning while waiting at the start
The depth of every touch is real as you need
But words don't do any favours for me (Ahh)
You will never know how hard I try
To keep from waning while waiting at the start
The depth of every touch is real as you need
But words don't do any favours for me (No)
You might also like
(You know)
(You know)
(You will never know)
(You know)
(You know)
(Oh)"
1406350,Tame Impala,The Sun,"The sun rose on the wrong side of the Earth this morning
Nobody noticed but you
So you winked at the sun
And the sun winked back, and you kept it to yourself
Alright
The stars are gonna give up hope this evening
Nobody knows this but you
When the small ones have imploded
And red giants have supernova'd
Then sorry the Earth will be
The sun rose on the wrong side of the Earth"
1989933,Tame Impala,That’s All For Everyone,"That's all for everyone
That's all for me
That's all for everyone
Must be just exactly what I need
I care for everyone
I cry for more
That's all for everyone
Must be just exactly what I need
That's all
I need somewhere to go
That's all
Must be what I need
That's all
I need someone to know
That's all
Exactly what I need
I can't stay
I can't deceive
That's all for everyone
Must be just exactly what I need
So that's all for everyone
That's all for me
That's all for everyone
Must be just exactly what I need
That's all
You might also like
I need somewhere to go
That's all
Must be what I need
That's all
I need someone to know
That's all
Exactly what I need
So that's all for everyone
Must be just exactly what I need
That's all
I need somewhere to go
That's all
Must be what I need
That's all
I need someone to know
That's all
Exactly what I need
That's all
That's all
That's all"
3061399,Tame Impala,Flow,"Well, the air is still but we are moving
I like the wind so wind the windows down
Oh!
See my flow
So we all
And now come back down again
Makes me wonder how I ever felt so good
Oh!
So alone
Feel it all
Flows down
Oh!
I'm already gone
I'm already gone
Wake me when you're done
Let me feel your flow
You might also like
Feel my flow
Feel at home
Feel alone"
8827046,Tame Impala,Retina Show (Unreleased Demo),"It's the retina show for your eye
It's the ego of instinctive desire
It's the reason that you make me break down and cry
It's the retina show for your eye
It's the ego of instinctive desire
It's the reason that you make me break down and cry
If you don't think it then it won't show
And you believe it too
Baby, tonight, it's written all over you
Baby, tonight, it's written all over you
Make me, make me feel love
Make mе, make me feel love
Makе me, make me feel love
Make me, make me feel love
It's the retina show for your eye
It's the ego of instinctive desire
It's the reason that you make me break down and cry
If you don't think it then it won't show
And you believe it too
Baby, tonight, it's written all over you
Baby, tonight, it's written all over you
You might also like
It's the retina show for your eye
It's the ego of instinctive desire
It's the reason that you make me break down and cry
It's the retina show for your eye
It's the ego of instinctive desire
It's the reason that you make me break down and cry"
3061366,Tame Impala,My Lover Mother Nature,"Outer space is the only place to hide now
From whoever wants to know where you are
Everything is easier than ever
When we fall baby we fall so hard
First conferred when the primates tried to warn me
When Adam ran off to make a fire
Mother Nature whispered to the apes now
We'll rebuild this place when they are gone
I was just another one
Waiting for the bees to come
I was Mother Nature's son
But I was just another one
Just another one
Oh"
