id,artist,title,lyrics
4973470,Tame Impala,It Might Be Time,"Something doesn't feel right
That's enough for one night
Hope y'all get home alright
There I go, blamin' on the weather
But hey, there's nothin' wrong
I'm only tired of all these voices
Always sayin' nothing lasts forever
It might be time to face it
It ain't as fun as it used to be, no
You're goin' under
You ain't as young as you used to be
It might be time to face it
You ain't as cool as you used to be, no
You won't recover
You ain't as young as you used to be
It might be time to face it
It might be time to face it
I've been lost before
So tell me it's not over
'Cause I finally got somethin' goin'
And suddenly
All my friends are growin' up
And movin' on
I must be missin' somethin'
You might also like
'Cause I just wanna keep this dream alive for now
Don't they know nothin' lasts forever?
It might be time to face it
Nobody knows what you've come here for, no
You're goin' under
They roll their eyes when you're at the door
It might be time
It might be time to face it (Yeah)
You may as well embrace it
We promise to come visit (Yeah)
It might be time
It might be time to face it (Yeah)
You ain't as fun as you used to be
You won't recover
You ain't as cool as you used to be
It might be time to face it
It might be time to face it"
5110376,Tame Impala,Is It True,"We were hangin' in the morning
Feelin' all different kinds of things
We were talkin' about everything
From the past to the happenin'
We started talkin' 'bout devotion
The kind that goes on eternally
And I tell her I'm in love with her
But how can I know that I'll always be?
She just said, ""Is it true? Is it true? Tell me now""
That's a promise I can't make and I won't validate
Was I in some kind of mood? I don't know, I don't care
Now I'm sleeping in my room, here I am, back again
She's in my
I was happy just listening
No intention to be mentioning
We started talkin' 'bout the future
Not the notion I was motioning
I'm just so terrified to face up
Like any moment I might wake up
'Cause she's the only thing I think of
I told my mother that I love her
You might also like
She just said, ""Is it true? Is it true? Tell me now""
That's a promise I can't make and I won't validate
Was I being immature? I don't know, I don't care
Now I'm sleeping in my room, here I am, back again
She's in my—
In my—
I said, ""We'll see, we'll see"" (In my—)
We'll see
Ah, we'll see
We'll see
We'll see, we'll see, we'll see
See how we go
Until we know what the future holds
Ah, we'll see
We'll see
We'll see, we'll see, we'll see"
4412281,Tame Impala,Patience,"Has it really been that long?
Did I count the days wrong?
Did we just go 'round and 'round
All the way to step one?
They would ask me all the time
Every time the show's up
""So what you doin' with your life?""
It ain't givin' up
Just growin' up in stages
(Lay down, low down)
Livin' life in phases
Another season changes
And still, my days are shapeless
It's always drive straight, don't be late
'Cause time waits for no one
I should be flying straight, with no delay
'Cause time takes from everyone
I'm just laying here
Waiting for a change to come
Take us to the place
Takin' us where we would have gone
You might also like
They would ask me all the time
Showin' up in ages
""So what you doin' with your life?""
Call it givin' up
I'm just growin' up in stages
(Lay down, low down)
Livin' life in phases
Another season changes
And still, my ways are aimless, I know
We're growin' up in stages
And I'm runnin' out of patience
Growin' up
It's always drive straight, don't be late
'Cause time waits for no one
I should be flying straight, with no delay
'Cause time takes from everyone"
1780161,Tame Impala,Disciples,"'Cause I was nervous, sure
But it's something I'm used to
And I could tell by your face
No one's ever been rude to you
When I could tell you things
That I can't say to anyone
And you came home today
But you didn't stay very long
Now it's like the world owes you
Walking around like everybody should know you
I wanna be like we used to
But now you're worried whose audience will lose you
And I had no idea
What that feeling could do to you
And I could tell you've changed
By the people around you
I used to take the long way
Just so I could walk past your door
I used to wait outside
But I guess I won't anymore
You might also like
There's so much I wanna tell you
So long, I wanna be there"
2165812,Tame Impala,Nangs,"But is there something more than that?
But is there something more than that?
But is there something more than that?
But is there something more than that?
But is there something more than that?
But is there something more than that?
But is there something more than that?
But is there something more than that?
But is there something more than that?
But is there something more than that?
But is there something more than that?
But is there something more than that?
But is there something more than that?
But is there something more than that?"
2167216,Tame Impala,Reality in Motion,"I'm edging closer, shivers all over
It's way too real, I'm way too sober
Usually they've got you covered all over
Lack of composure, I'm walking over
What will I do?
I never had a chance to
There's no one else around you
Not that I was waiting, vision ever fading
Heading for the deep end
Soon as I remember, baby, I surrender
I just need to breathe out
Decisions are approaching, reality in motion
Tryna be patient but I'm feeling ancient
Tryna control the way that I'm facing
Suppose that I didn't care anymore
Fate can decide, I can ignore
I'll just pretend that I always knew
That I had the chance to
You might also like
There's no one else around you
Not that I was waiting, vision ever fading
Making such a promise
Only leads to heartache, closer to an earthquake
Talked about in Hollywood
Tryna stay in motion
It made my heart run in circles and overflow
And I was closer than ever to letting go
It made my heart run in circles and overdrive
And I was closer than ever to feeling alive
It made my heart run in circles and overflow
And I was closer than ever to letting go
It made my heart run in circles and overdrive
And I was closer than ever to feeling alive
There's no one else around you
Not that I was waiting, vision ever fading
Heading for the deep end
Soon as I remember, baby, I surrender
I just need to breathe out
Decision are approaching, reality in motion
Let's not think about it
Put your arms around me, I can sense you doubt me
You don't need to promise
That only leads to heartache, closer to an earthquake
Talked about in Hollywood
All there's left to do
All there's left to do, all there's left to do
All there's left to do, all there's left to do
All there's left to do, all there's left to do
All there's left to do, all there's left to do
All there's left—"
5175146,Tame Impala,One More Hour,"Just a moment
Right before all the song and dance
Wasn't brave enough to tell you
But there ain't gonna be another chance
It's not long until (All that I have)
And everything's still (One more hour)
Minutes are racing, whatever I've done
I did it for love (All that I have)
I did it for fun (One more hour)
Couldn't get enough (All that I have)
I did it for fame (One more hour)
But never for money
Not for houses, not for her
Not for my future children
Until now
How could I love again?
How could I ever ask for more?
And to the road ahead
Into a life I can't ignore
(Lose her) How could I love again?
(Move on) How can I walk this path for sure?
(Lose her) With no more time to spare
(Move on) I know the answer more and more
You might also like
As long as I can, long as I can
Spend some time alone
As long as I can, long as I can
Be the man I am
Ooh, life is strange
For one more hour
I can rage
For one more hour
As long as I can (Lose her), as long as I can (Move on)
Spend some time alone
As long as I can (Lose her), as long as I can (Move on)
Remember who I am
As long as I can (Lose her), as long as I can (Move on)
Spend some time alone
As long as I can (How could I love again?), as long as I can
Be the man I am
Just a minute, fella, right before you go out there
All your voices said you wouldn't last a minute bare
One more hour and you'll know your life is one to share
Just a minute, baby, right before we go from here
All those people said we wouldn't last a minute near
I'm with you and I could roll into another year
Just a minute, fella, right before you go out there
All your voices said you wouldn't last a minute bare
One more hour and you'll know your life is one to share
Just a minute, baby, right before we go from here
All those people said we wouldn't last a minute near
I'm with you and I could roll into another year
Just a minute, fella, right before you go out there
All your voices said you wouldn't last a minute bare"
136103,Tame Impala,Apocalypse Dreams,"This could be the day that we push through
It could be the day that all our dreams come true
For me and you
Till we're at the end of just another day
Are you too terrified to try your best?
Just to end up with an educated guess
Like success
Like those times you wake up mystified
Oh, it feels so real in my sleep
Never held something so close I couldn't keep
Into the day, the strangest feeling
Do you really live without the fear that
Everything is changing
And there's nothing I can do
My world is turning pages
While I am just sitting here
Well, am I getting closer?
Will I ever get there?
Does it even matter?
You might also like
Do I really need it?
Push it out the window
On and on, we all go
(This could be the day that we push through)
Into another morning
Doesn't even matter
It was only yesterday
(It could be the day that all our dreams come true)
Didn't even know you
Now I'm gonna miss you
(Oh, it feels so real in my sleep
Never held something so close I couldn't...)
Nothing ever changes
No matter how long you do your hair
Looks the same to everyone else
Everything is changing
I guess I should warn my mum
But she'll just be excited"
5175455,Tame Impala,On Track,"I close my front door and turn on the light
I let out a breath and hold in a sigh
Ain't nothin' new, ain't that much in sight
And if I'm counting days, dream fruition ain't what it's looking like
But strictly speaking, I'm still on track
Strictly speaking, I'm holding on
More than a minor setback
But strictly speaking, I'm still on track
And all of my dreams are still in sight
'Cause strictly speaking, I've got my whole life
I lost a wheel a while back
But strictly speaking, I'm still on track
Challenges falling in my lap
Strung out again, but still on track
I know it's unrealistic, over-optimistic
I know I tried before this, I know it's nearly August
I know I can't ignore this, looking forward to all this
Sayin', ""Babe, I just adore this"" and, ""Babe, can we afford this?""
I know it's been a slow year, nothin' much to show here
I didn't really go for it, so not a lot to show for it
You might also like
The hardest part is over, adjusting makes it slower
So glad you're comin' over, a wall to bring us closer
The world ain't waitin' for ya, nothin' to lose it over
We're just a little older, the rest comes easy
The rest comes easy
('Cause life's like that)
But strictly speaking, I'm still on track
Strictly speaking, I'm holding back
Troubles keep falling in my lap
Yeah, but strictly speaking, I'm still on track
So tell everyone I'll be alright
'Cause strictly speaking, I've got my whole life
More than one major setback
But strictly speaking, I'm still on track (Yeah)
The hardest part is over, adjusting makes it slower (Ooh)
So glad you're comin' over, a wall to bring us closer (Still on track, motherfucker)
The world ain't waitin' for ya, nothin' to lose it over
We're just a little older, the rest gets easy
The rest gets easy"
136131,Tame Impala,It Is Not Meant To Be,"I wanted her, I wanted her
But she doesn't like the life that I lead
She doesn't like the life that I lead
Doesn't like sand stuck on her feet
Or sittin' around smokin' weed
I must seem more like a friend in need
And I boast that it is meant to be
But, in all honesty, I don't have a hope in hell
I'm happy just to watch her move
And in all honesty, I don't have a hope in hell
I'm happy just to watch her move
And she doesn't like the friends that I make
Doesn't make friends for friendship's sake
She just gets bored sitting by the lake
Her soul won't surface and her heart won't ache
And I boast that it is meant to be
But, in all honesty, I don't have a hope in hell
I'm happy just to watch her move
You might also like
And I thought they could cure his disease
But, in all honesty, he didn't have a hope in hell
Now we'll never see him move"
93158,Tame Impala,Why Won’t They Talk to Me?,"Out of the zone, trying to see
I'm so alone, nothing for me
I guess I'll go home, try to be sane
Try to pretend, none of it happened
Oh, this old tree, lonely old me
Whoops-a-daisy, I thought I was happy, oh
Out of this zone, now that I see
I don't need them and they don't need me
I guess I'll go home, try to be sane
Try to pretend, none of it happened
Destined to be, lonely old me
Whoops-a-daisy, I thought I was happy, oh
Ah, why won't they talk to me? (I thought I was happy)
Ah, why won't they talk to me? (I thought I was happy)
Ah, why won't they talk to me? (I thought I was happy)
Ah, why won't they talk to me?
Ah, why won't they talk to me?
But I don't even care about it anyway
I wouldn't listen to a word any of them say
They just talk about themselves all day
One day I'll be a star, and they'll be sorry
You might also like
Ah, why won't they talk to me?
Ah, why won't they talk to me?
Ah, why won't they talk to me?
Ah, why won't they talk to me?
Ah, why won't they talk to me?"
5110372,Tame Impala,One More Year,"Do you remember we were standing here a year ago?
Our minds were racing and time went slow
If there was trouble in the world, we didn't know
If we had a care, it didn't show
But now I worry our horizons bear nothing new
'Cause I get this feeling and maybe you get it too
We're on a rollercoaster stuck on its loop-de-loop
'Cause what we did one day on a whim
Has slowly become all we do
I never wanted any other way to spend our lives
I know we promised we'd be doing this 'til we die
And now I fear we might
Ooh, now I fear we might
But it's okay
I think there's a way
Why don't we just say, ""One more year""? (One more year)
Not worryin' if I get the right amount of sleep (One more year)
Not carin' if we do the same thing every week (One more year)
Of livin' like I'm only livin' for me (One more year)
Of never talkin' about where we're gonna be (One more year)
One more year
Of livin' like the free spirit I wanna be
You might also like
We got a whole year (One more year)
Fifty-two weeks
Seven days each
(One more year) Four seasons, one reason, one way
One year (One more year), one year
One year, from today
From today
I never wanted any other way to spend our lives
Now one of these is gonna be the last for all time
For all time
One more year"
5148635,Tame Impala,Tomorrow’s Dust,"There's no use trying to relate to that older soul
And no use trying to debate that they've got it wrong
There's no use pining for love when you're on your own
And no use crying outside if nobody's home
There's no use flying to the moon if they won't believe
So why do I go wrong on repeat?
I was blinded by a memory
Like it's someone else, like it wasn't me
And there's every chance I'll be learning fast
And the day will come and then it will pass
What do you want when I say I won't?
And though I try, I do the same, as though I must
And in the air of today is tomorrow's dust
There's no use trying to relate to that older soul
And no use biding your time if the bell is tolled
I was blinded by a memory
Like it's someone else, like it wasn't me
And there's every chance I'll be learning fast
And the day will come and then it will pass
You might also like
Sympathy for the fauna
Fragile life in the sauna
In the sea getting warmer
Endlessly 'round the corner
And though I try, I do the same, as though I must
And in the air of today is tomorrow's dust"
5175450,Tame Impala,Instant Destiny,"I'm about to do something crazy, no more delayin'
No destiny is too far
We can get a home in Miami, go and get married
Tattoo your name on my arm
This traffic doesn't seem quite as annoying
Quite alright, quite alright, sittin' here
Yes, reminiscent, I think this is different
I know this is different (I'm about to)
Let's cause something permanent
Just so we know we can
I'm about to do something crazy, no more delayin'
No destiny is too far
Did you say, ""And here comes forever""?
Oh, here forever, let go of me with open arms
We'll be lovers until the end of time (I'm about to)
I see it now
I see just how you're so right (I'm about to)
You're so clear now
You might also like
I'm about to do something crazy, no more delayin'
No destiny is too far
We can get a home in Miami, go and get married
Tattoo your name on my arm
Let's drink this magic potion
Of love and devotion
And then let's see how it goes"
136099,Tame Impala,Endors Toi,"Soothing repeat
I look down at my feet
It's a hypnotist's arm
And it works like a charm
But I won't be deprived
Real worlds, surreal life
Though I doubt there is time
Go to sleep, you'll be fine
In the morning you'll find
Real life was such a grind
Off I go, day is done
Where a new one's just begun"
135090,Tame Impala,Nothing That Has Happened So Far Has Been Anything We Could Control,"Nothing that has happened so far has been anything we could control
I am just here waiting for the perfect time to tell you I don't know
Maybe I'm just reading into it a little deeper than I should
We would make it easy, we would take it slowly, if only we could
Hey, what are you doing out here? You're thinking about everything, aren't you? I know it’s crazy, just don't think of it like that. Nothing has to mean anything. Come on, come back inside
Elodie, look at me, unless you're tryin' to hurt me
Heavy blow, down I go, now I just want to let go
Is it right? Is it wrong? I don't know
It's not the cause I'm fightin' for anymore, but it sucks to keep on runnin'
Eventually, there will be a time for clearer thinking
For now, I weep, can't get to sleep, I try to hold a good feeling
I just get one, here it comes, there it goes
Now we just might lose the fight, yeah, but it's alright, it wasn't our decision
Nothing that has happened so far has been anything we could control
I am just here waiting for the perfect time to tell you that I know
Every man is happy until happiness is suddenly a goal
I'll just be here waiting 'til the doctor calls and then I'll let you know"
92848,Tame Impala,Solitude Is Bliss,"Cracks in the pavement underneath my shoe
I care less and less about it and less about you
No one else around to look at me so
I can look at my shadow as much as I please
All the kicks that I can't compare to
Making friends like you're all supposed to
Oh, you will never come close to how I feel
You will never come close to how I feel
Space around me where my soul can breathe
Off-guard body that my mind can leave
Nothing else matters, I don't care what I miss
Company's okay, solitude is bliss
There's a party in my head
And no one is invited
And you will never come close to how I feel
You will never come close to how I feel
You might also like
Movement doesn't flow
Quite like it does when I'm alone
I'll be the one that's free
You and all your friends can watch me
Today
(Don't ask me how you're supposed to feel)
You will never come close to how I feel
You will never come close to how I feel
You will never come close to how I feel
You will never come close to how I feel"
456417,Tame Impala,Alter Ego,"Said the voice from afar
""Don't you know it doesn't have to be so hard?
Waiting for everyone else around to agree
Might take too long
Might take too long""
""When, it won't be so hard"" (It won't be so hard)
Well, it's true, yes, but you won't get far telling me
That you are all you're meant to be
When the one from my dream
Is sitting right next to me
And I don't know what to do
Oh, alter ego
Get them to love you, while they may
Depending on your words and wealth
The only one who's really judging you is yourself
Nobody else
Nobody else
If I could part
It wouldn't be so hard (It won't be so hard)
Well, it's true, yes, but you won't get far telling me
That you are all you're meant to be
When the one from my dream
Is sitting right next to me
And I don't know what to do
Oh, alter ego"
3321414,Tame Impala,List of People (To Try and Forget About),"Now I gotta add you to my list of people to try and forget about
Now I gotta add yours to my list of faces to try and not think about
Now I gotta tell 'em I don't care and hope that nobody might work it out
It was obviously an illusion 'cause there's never been so much I've been wrong about
And I don't want to spend all my days thinking of the one I can't live without
So I'm gonna have to add you to my list of people to try and forget about
To try and for-
And as the years go by youur name will fade out gradually
They'll think my heart went dry, but it was waiting in-
So now I gotta add you to my list of people to try and forget about
It could've been magic, nearly had ya, can you imagine? Nearly had ya
'Til it becomes another one of the things that I just can't talk about
I'm gonna have to keep you on my list of people to try and forget about
Try and for-
You might also like
(Ooh, ooh)
(Ooh, ooh)
And as the years go by your name will fade out gradually
They'll think my heart went dry, but it was waiting in the wings
And as the years go by you'll stay a banished memory
They'll say my love has died, but it was waiting in the wings"
136118,Tame Impala,Keep On Lying,"All I give are little clues
Maybe, one day, I'll get through
But there is nothing I can do
I'll just keep on lying to you
I only need to say it's true
Your poor little heart already knew
But there is nothing you can do
I'll just keep on lying to you
Should my cover ever blow
Would you ever let it go?
There is something you should know
But hell if I'd ever let it show
So here I am, trying to be strong
It was noon, now my shadow's long
I guess I'll go and tell you just as soon
As I get to the end of this song
To the end of this song
To the end of this song
To the end of this song
To the end of this song
You might also like
The curse has won again
Soon I'll be alone
Take all you can
Please understand
That it never really was love
All I give are little clues
Maybe one day I'll get through
There is nothing you could do
I'll just keep on lying to you"
136112,Tame Impala,Music to Walk Home By,"But that's only when I think of you (Think of you, think of you)
Some vision that I hold on to (Hold on to, hold on to)
You know it's everything I do (Thing I do, thing I do)
You know it's everything I do (Thing I do)
Can almost stand competing with the others
Can almost hear the fun that I should be having
Instead of all this dreaming
But it's only when I think of you (Think of you, think of you)
The mover I could turn into (Turn into, turn into)
There must be something I can do (I can do, I can do)
Yeah, there must be something I can do
I just don't know how to feel right
A beautiful girl is wasting my life
I'm playing a part as somebody else
While tryin' so hard to be myself
I just need to hear somebody say
This will all make sense one day
I guess I'm alright, but they're all doing so well
What I would give to be under that spell
You'll know soon
You'll know soon
You'll know soon
You'll know soon
You'll know soon (Yeah)
You'll know soon (Yeah)
You'll know soon (Yeah)
(Yeah, yeah, yeah)
(Yeah, yeah, yeah)
You might also like
But you don't know the truth
I'm in love with you
You just don't believe
In anything I do
In so many ways I'm somebody else
While tryin' so hard to be myself
I just need to hear somebody say
This will all make sense one day
Well it's getting late, I'd better go
I made it this far as far as I know
In so many ways I'm somebody else
While tryin' so hard to be myself
I just need to hear somebody say
This will all make..."
1445179,Tame Impala,Why Won’t You Make Up Your Mind?,"Why won't you make up your mind?
Give me a sign
Why won't you make up your mind?
Give me a sign
Am I wasting my time living in my head?
You'll be sorry when I make up mine instead
Why won't you make up your mind?
Give me a sign
Why won't you make up your mind?
Give me a sign
Am I wasting my time living in my head?
You'll be sorry when I make up mine instead"
2165829,Tame Impala,Gossip,21 ContributorsThis song is an instrumental
136128,Tame Impala,Sun’s Coming Up,"All those things I ever, thought would never end
To think they're now all memories, sends me 'round the bend
To watch her airplane swaying, coming in to land
There, my world is hanging, in someone else's hands
And if I have done something, and you have to let me go
Think of me as someone, someone that you know
But if I don't hear something, pretty soon from now
I'll disconnect completely, see how that works out
I wasn't, daring, not much a chancer
Oh, my darling, why won't you answer?
7 A.M, midnight in Dover
Sun's coming up now, I guess it's over
Playing his guitar, while he's dying of cancer
Oh, my father, why won't you answer?
7 A.M, midnight in Dover
Sun's coming up now, I guess it's over"
